{
  "schema_version": "1.0",
  "relay_id": "relay-v2-001",
  "message_id": "msg-v2-schema-001",
  "created_at": "2026-09-25T05:11:00Z",
  "deliveries": [
    {
      "agent_id": "grok",
      "delivery_status": "completed",
      "handling_mode": "manual",
      "ack_at": "2026-09-25T05:11:20Z",
      "completed_at": "2026-09-25T05:11:30Z",
      "attempts": 1,
      "last_error": null,
      "processed_at": "2026-09-25T05:11:30Z",
      "idempotency_key": "msg-v2-schema-001:grok"
    },
    {
      "agent_id": "chatgpt",
      "delivery_status": "pending",
      "handling_mode": "manual",
      "ack_at": null,
      "completed_at": null,
      "attempts": 0,
      "last_error": null,
      "processed_at": null,
      "idempotency_key": "msg-v2-schema-001:chatgpt"
    },
    {
      "agent_id": "agent-a",
      "delivery_status": "pending",
      "handling_mode": "automatic",
      "ack_at": null,
      "completed_at": null,
      "attempts": 0,
      "last_error": null,
      "processed_at": null,
      "idempotency_key": "msg-v2-schema-001:agent-a"
    }
  ]
}
